id,candidato,temas_tratados,descripcion,entrevista
LG1,Luisa Gonzales,justici social propuest corrupcion,entrev relev entend propuest vision polit luis gonzalez context crisis econom social segur ecuador,buen dias lenin salud escuch moment revolu ciudadan proyect patri busc justici social vid armon paz hoy quer reviv ecuador agoniz falt emple salud educ objet devolv esper alegr dias mejor proyect ahor encabez muj luis gonzalez junt dieg borj represent sierr ecuatorian pais cambi proyect hoy viv desesper tristez violenci sum opcion emple insegur dispar ecuador segur hoy pais violent sudamer segun hum rights plan enfoc constru paz justici social enfoqu estructur segur plan proteg contempl equip fuerz public mejor inteligent trabaj maner coordin fuerz armad polic nacional ademas plan impuls trabaj are especif niñ joven mujer cabez hog adult mayor priorid unir patri divid rafael corre sig proces cort internacional demostr cas persecu polit cuant jorg glas si ley trat internacional determin deb recib salvoconduct asil mexic entreg cumpl normat si gobiern años hac obra dia posibl comet error import trabaj junt gent recorr territori unir ecuador enfoc pas sin futur justici social emple segur man dur corrupcion si detect cas gabinet tom tod accion legal necesari vam toler red corrupcion institu public pondr orden pais equip capacit invit socied civil industri part polit unirs proyect levant ecuador necesit coordin gobiern asamble justici garantiz sistem eficient interfer justici hoy gobiern incumpl normat trabaj coordin intervencion vam fortalec institucional juec fiscal hag trabaj maner imparcial cre ley comun garantic respet honr inform veraz medi deb correg si public inform errad proteg honor person enfoqu fortalec cooper pais inclu unid union europe latinoamer deb unirs negoci bloqu busc alianz comercial segur relacion internacional pais enfoc polit comerci segur exclusion much graci usted
LG2,Luisa Gonzales,crisis electr relacion internacional accion,entrev ofrec vision clar prioridad estrategi luis gonzalez enfrent desafi econom social polit ecuador,much graci buen dia ecuatorian mir moment cre aqu trat gan perd sin puebl ecuatorian conozc propuest candidat propuest deb ser seri contrast real realiz cambi mentir verd bloqu debat confront ataqu fundament lug enfoc propuest present part plan proteg gener impuls dispon red social total acuerd ecuador pierd present ofert sustent pued promet tren bal siqu complet metr quit campañ anterior mentir gan lueg cumpl promes baj preci combust impuest ultim año sol cre emple sin perd puest trabaj ciudadan deb reflexion diferenci promes vac propuest realiz gust debat direct daniel novo ubic bloqu distint ret debat direct primer vuelt si cne permit recib amenaz campañ anterior moment detuv person armad quer atent vid ahor continu amenaz ministeri defens tom med confi fuerz armad aunqu cre deb ser depur invit ciudadan revis plan gener plante rehabilit capac instal much termoelectr oper maxim capac dad manten trabaj empres priv desarroll nuev proyect eolic termoelectr fotovolt ademas complet proyect cardenill mw fortalec sistem necesit compr energ si segu plan maestr electr barcaz energet signific gast innecesari deb ser elimin exjuez saquicel liber rasquiñ sembr terror ecuador ahor mism juez atac rafael corre hombr inocent sentenci injust interpol rechaz tres vec difusion roj demostr sustent conden import ciudadan conozc contradiccion jamas deb reflexion quien segur sistem justici actual exist derech vam depur juec fiscal corrupt favorec delincuent fortalec uaf requier nuev ley sin devolv presupuest contrat personal adecu hac seguimient report garantiz justici actu siempr respet volunt puebl hic consult yasun gast diner consult repetit requier liderazg accion puebl herman cuant asum president segur claudi sheinbaum asist posesion restablec relacion comercial si necesari conform derech internacional har voy recompon relacion necesari gener emple salud educ necesit inversion estabil sac millon ecuatorian pobrez esper polit migratori human crisis migratori ecuatorian alarm graci usted
LG3,Luisa Gonzales,venezuel rafael corre persecu,gonzalez defiend independent capac lider critic justici ecuatorian enfatiz neces unid liderazg super crisis pais ademas respond pregunt relacion rafael corre corrupcion vision polit exterior,quer fern necesit consult ningun asesor manej comun muj capaz inteligent vam ver desafi muestr cuant pais mund viol derech human mantien relacion comercial unid ojal pod dialog pais viol derech human comerci unid sol mencion venezuel habl palabr aisl cumbr iberoamerican nacion ecuador anfitrion ningun gobiern asist aisl igual relacion rot mexic soci comercial clav ecuador cerr crecimient pobrez extrem pobrez afect casi mit poblacion jug vid eleccion debat permit expon plan trabaj atac rafael corre problem pais llam unid dej confront odi si daniel novo acept invit debat confront mentir verd demostr plan estructur ecuador candidat mencion corre propuest clar rafael corre lid histor revolu ciudadan hombr inocent president part dirij campañ gobiern ecuador gobern justici ecuatorian apen aprob viol derech oper baj vici derech ecuador viv dictadur ecuador decrec pobrez violenci cort electr falt inversion extranjer necesit gobern liderazg gener emple mejor segur fortalec econom glos uso avion presidencial cumbr iberoamerican panam particip barack obam ridicul part persecu polit ecuador si mal aqu dand car disgust habl encant volv convers
JC1,Juan Cueva,propied intelectual panoram ecuatorian,abord tem clav relacion proteccion gestion derech propied intelectual explic concept fundamental propied intelectual import organiz emprendedor desafi enfrent camp mund globaliz digitaliz,propied intelectual derech cualqui autor creador inventor obra invencion traves ciert derech exclus proteg creacion dos grand ram derech autor propied industrial derech autor aplic obras literari musical artist cualqui creacion manifest creativ propied industrial refier invencion marc patent diseñ industrial demas creacion aplic camp industri organiz deb integr propied intelectual maner estrateg herramient proteg activ valios invencion marc recurs intang integr inici proces innov desarroll clav obten ventaj competit proteg competent larg plaz monetiz activ mediant licenci vent maner sol proteg invent creacion sin fortalec posicion organiz merc primer eduqu marc legal proteg creacion conoc derech propied intelectual permit tom decision inform ejempl registr patent solicit derech autor ademas deb busc asesor legal inici evit invencion qued desproteg si proteg derech pued copi ide podr desvirtu negoci ten cuent propied intelectual sol derech exclus sin form gener ingres traves licenci vent derech propied intelectual pued vend licenci titul derech decid transfer total parcial derech person u organiz vent implic transferent complet derech creacion mientr licenci contrat permit part usar propied intelectual baj ciert condicion limit ejempl tipic empres softwar licenci codig fuent compañ utilic tip acuerd creador pued manten control creacion mientr recib ingres licenci mayor desafi falt conoc concienci emprendedor organiz general import proteg creacion much vec creador dan cuent valor tard context globaliz digitaliz proteccion derech propied intelectual vuelt complej violacion pued ocurr facil traves internet plataform digital plante ret import termin aplic hac cumpl defend derech proces registr patent var segun pais general sig pas primer deb asegurart invencion nuev invent suscept aplic industrial lueg deb realiz solicitud formal oficin patent pais correspondient inclu descripcion detall invencion ventaj seri dibuj diagram si necesari posterior oficin realiz exam fond verific invencion cumpl requisit ser patent si orden conced patent general duracion años import cont abog especializ propied intelectual asist proces ecuador avanz ultim años cuant legisl proteccion derech propied intelectual aun hac aunqu marc legal alin estandar internacional much vec empres emprendedor dan import deb ademas sistem justici ambit necesit ser agil cas infraccion pued tard tiemp resolv embarg concienci crec nuev gener cad vez interes proteg invencion creacion cre gran potencial desarroll camp si sig hac esfuerz educ person import propied intelectual
JC2,Juan Cueva,proyect polit experient corrupcion,entrev juan ivan cuev candidat presidencial movimient amig compart vision propuest ecuador explic motiv postul president experient sector public priv enfoqu unid bienest pais alla ideolog ademas detall plan inicial gobiern reduccion iva fortalec segur enfatiz compromis transparent luch corrupcion,much graci lenin invit honor aqu present ciudadan realment indign cans situacion actual pais moment ciudadan dem pas adel qued marg prepar tod vid ser president trabaj part public priv asesor pep mujic recorr ecuador conoc neces ciudadan demand joven polit gent nuev vincul polit tradicional necesit hab pas part polit dec prepar sin cont capac prepar dirig pais recorr ecuador loj manab qued lugar olvid polit socialdemocrat cre balanc reun part encontr amig valor objet comun alquil part lider proyect polit defiend ecuador corrupt inept coalicion person part cristin rey provien centroderech yaku perez centroizquierd confi proyect busc bienest ecuador alla etiquet ideolog ningun relacion especul revis histori part figur nombr fundacion registr cne conoc hac seis siet mes empez proyect polit socied demand lider prepar cristin experient compromis defens mujer justici social trabaj desplieg television digital terrestr fibr optic moderniz servici estatal uruguay primer decret enfoc segur desarroll baj iva bas curv laff indic impuest menor pued aument recaud fortalec segur plan concret present asesor segur jos luis cherr trabaj nayib bukel donald trump miembr gobiern pas prueb confianz poligraf analisis financier ser design aventur podr sector priv decid dar pas adel ecuador permit pais sig secuestr violenci falt emple corrupcion empres produc cervez artesanal loj priorid ecuador graci usted espaci
JC3,Juan Cueva,colabor sector desafi proteccion cas exit sostenibil,entrev juan ivan cuev compart experient conoc proteccion escal innov tecnolog abord tem clav import propied intelectual colabor univers empres sector public desafi enfrent emprendedor ambit ademas ofrec consej practic transferent tecnolog destac neces enfoqu sosten innov,estrategi consider efect ver proteccion propied intelectual import cont registr patent derech autor model util creacion red ecosistem colabor esencial aprovech sinergi diferent actor sector ademas escal pas transferent tecnolog sector ampli merc internacional fundamental ecosistem innov fortalec colabor activ academi industri sector public univers aport conoc talent empres aplic tecnolog sector public jueg rol import legisl creacion incent transferent tecnolog deb ser proces estructur bast ten invencion deb exist marc facilit transferent acuerd licenci contrat colabor alianz estrateg ademas crucial cont personal capacit pued gestion proces maximiz valor innov propied intelectual herramient clav proteg innov proteccion adecu empres institu corr riesg perd derech avanc tecnolog ademas buen portafoli propied intelectual pued atra inversor gener ingres mediant licenci acuerd comercial mayor desafi falt concienci import proteg adecu ide much vec emprendedor enfoc sol desarroll tecnolog ten cuent derech propied intelectual ademas gran varied regul nivel mundial pued complic proteccion distint merc ret financi escal requier recurs pod llev innov gran escal primer educ concienci emprendedor import proteg invencion nivel legal necesari cont asesor adecu asegur derech bien proteg local internacional cuant financi pued explor distint fuent fond public inversor priv siempr enfoqu estrateg asegur crecimient sosten model licenci alianz estrateg efect empres pued licenci tecnolog mejor posicion comercializ adapt nuev merc joint ventur colabor vari part pued ser camin efect combin recurs conoc diferent sector cas represent trabaj conjunt univers local empres multinacional logr transfer tecnolog desarroll univers industri traves acuerd licenci proces sol implic proteccion propied intelectual sin desarroll estrategi comercializ permit tecnolog lleg nuev merc gener ingres univers aument competit empres emprendedor deb consider viabil financ capac adapt innov sostenibil sol ver benefici econom sin impact social ambiental pued gener ademas deb ten cuent evolu tecnolog merc siempr cambi import manten actualiz consej subestim import propied intelectual inici proyect crucial ten plan clar estructur proteg gestion transfer tecnolog esencial rod expert distint ambit cubr proces legal comercializ olvid innov deb ten proposit clar gener valor socied
