id,candidato,temas_tratados,descripcion,entrevista
FT1,Francesco Tabacchi,gobiern guillerm laz polit fiscal gener emple petrole min inversion extranjer min ilegal reform segur plan segur man dur salvador rol sov educ infraestructur concesion obra public propuest econom polit energet sector agropecuari,francesc tabaqui candidat presidencial movimient cre expon propuest mejor segur econom sector agropecuari ecuador critic polit fiscal gobiern actual afirm deb aument impuest propon abrir puert inversion priv sector estrateg petrole min asi transform agricultur haci “ agricultur ” materi segur tabaqui abog enfoqu man dur man just tom ejempl salvador combat delincuent mencion import dar incent gener emple mejor infraestructur garantiz ambient segur inversion ademas destac gobiern exit deb rod person prepar competent,especial eleccion avanz dialog candidat hoy contact direct francesc tabaqui ganader años conform blanc saquicel binomi movimient cre blanc saquicel blanc saquicel experient polit francesc tabaqui gremial resum ser gobern guay candidat prefect guay mism agrup ademas president asoci ganader litoral galapag encabez feder ganader ecuador patrimoni segun declar entreg contralor hac dos años borde millon dolar superintendent compañ const president tri sas ademas gerent tres empres accion cinc compañ pag sum dolar impuest rent sal divis propuest aspir lleg carondelet consegu cooper internacional fortalec rehabilit social carcel licit camp petroler madur empres priv reabr escuel rural cuatr años car hij integr band delict entreg armas implement inteligent artificial detect esquem fraudulent contrat public candidat buen dias bienven contact direct buen dias graci espaci usted candidat organiz polit lleg pod termin anticip period figur muert cruz lleg pod usted continu lin gobiern objet plante moment president guillerm laz hoy candidat sol cre usted mencion gobern ultim dia gobiern pas much honr candidat agricultor productor ganader candidat emprendedor candidat sid tom cuent segu lin lin tom sol gobiern pas gobiern gobi anterior siempr buen cual mal dej enterr buen empec ahor gobiern actual parec mand ley asamble permit empres priv pued invert sector electr asamble prob parec bien segu continu entreg tanquet ambul ciert unidad educ hiz gobiern pas parec bien gobiern ex president laz primer quit usted mordaz usted hoy dia sol pod ten entrev pod ten debat lueg vin vacun lueg gobiern anterior met man bolsill gent cre nuev impuest usted dar mism pued met impuest ciudadan impos hac dec va quit va reduc iva punt men prim año impos van quebr ecuador dec verd gent quier dig verd segu usted objet salari basic ubiqu dolar quizas metas alta siempr buen sub gener emple primer hac recuper mil emple perd crisis energet mil emple mir suel siempr abaj ahi abaj suel petrole energ min poquit arrib obra public extrañ obra public hac años poquit arrib sector agro product gener emple hac años podr dec turism industri com logr pued dec com dond cuant ok adel moment dej met naric hac mal petrole energ min obra public empiec abrirl puert inversion extranjer com hech pais va ahorr mil millon dolar ahi pod tom mil dolar millon millon dolar perdon graci invert sector product hac agricultur signif transform agropecuari dej met naric sector petroler signif concesion com deb entend abrir puert jamas habl privatiz peor estatiz ecuador poz petroler invert invert millon dolar poz millon dolar hac tiemp nadi aparent interes ello com cambi situacion buen primer permit veng dand segur jurid invit lueg dand incent incent tributari incent contrat joven ahor mund apel vot jov apel joven veng trabaj candidat ver recuerd realiz much rond ecuador open for business llam present distint lugar mund tem petroler tem energet tem turism tem min inversion lleg entonc va hac usted diferent ahor volv mostr mism carter sector si logr convoc inversion destrav hac cos rap hac bien abrir puert deshac cos destrav buen empec min parec sab convert min dej min ilegal voy aqu lad entrev pas habl colombi peru peru mism bet mism line mism cordiller señor arqued ahi concesion dos apen sab cuant ingres ecuador millon dolar bastant sab cuant ingres peru mil millon dolar vec usted va dec quer mil millon dolar veng sab com destrav man militar sac ilegal hech carg min dej empres priv buen igualit hac polit ok si tan sencill mand militar sencill sencill depend expresion polit cos siempr complic hac destrav hac cos rap hac cos bien ok cual trab dispon militar vay zon tom miner ilegal sac lug se cual trab actual sab encontr trab uvo primer gobern guay ahor oportun aport ahor oportun ser president republ si dios permit ecuatorian supuest ten volunt supuest conoc conoc sab moment pais gener emple permit veng multinacional veng empres priv veng inversion mit problem resuelv sab ten clar pued hac pued hac usted viaj salvador recient conoc accion desarroll pais materi segur plan aso camin camin plan buquel mir ex president aso mand decret permit ampar polic utiliz armas delincuent gobiern actual mand decret guerr serv aprend hac especial si dar result manodur manodur man just salvador reun jef banc nayibuquel explic cual situacion cual numer dim cuent man dur dad oportun gent quier dem bal gent quier polic lleg chalec vehicul armas lleg libr unidad educ medicin hospital dentr plan gobiern usted sab escuadron pacif mejor hombr fuerz armad polic nacional entren fuerz guerr pod belic pais manten trat ocup ahor sum salvador palabr dad ex president sov particip activ campañ vem hac recorr desarroll reunion distint tip acompañ candidatur si usted lleg president rol va ten respect campañ efect vi ayer comenz mov imagin deb muer envidi sab pued regres pais buen brom enter sov ahor retir polit alla salg recorr camin pued adelant president republ pens deb derrod siempr gent prepar inteligent asesor entonc respect cre cumpl ecuatorian cre president republ francesc tabaki candidat presidencial cre graci acompañ mañan contact direct compart propuest cas lleg president graci jos graci jos graci jos graci jos graci jos graci usted espaci
FT2,Francesco Tabacchi,segur man dur crim reform judicial corrupcion juec fiscal rehabilit social sistem penitenciari acces salud abastec medicin reform cercop crisis iess gener emple incent fiscal contrat reform educ bachillerat tecnic inversion extranjer min petrole energ concesion vial crisis energet polit exterior relacion mexic venezuel impact administr donald trump migracion,francesc tabaqui candidat presidencial cre enfatiz enfoqu man dur just crim inclu reform judicial depur fuerz segur propon incent fiscal foment emple moderniz sistem educ atra inversion extranjer sector estrateg energ min petrole plante copi model exit gestion salud compr public deleg vicepresident reform cercop polit exterior busc restablec relacion mexic manten postur firm frent venezuel analiz impact posibl administr donald trump migracion ecuatorian abog enfoqu negoci eeuu manej deport trat comercial,leo bienven formal francesc tab graci aqu mañan buen dias buen dias graci usted invit ahi quier empez elem campañ man dur man just man inteligent quien exact man dur delincuent man dur terror man dur juec fiscal corrupt man just tod person ecuador necesit oportun hij delincuent nac vocacion incuent man inteligent dar oportun hac pais prosper rest ahi cuestion precis plan usted dic podr aplic darl bec hij aquell delincuent entren armas va cont bec persuad cuestion va sum accion romp circul romp segur delincuent van quer baj armas hag cad diez hag cad cien perfect rest van ser atend escuadron pacif llev vid carcel dentr propon endurec pen ejempl caden perpetu pas asamble asamble segun encuest cas usted gan mayor respald hac pens van cambi parec legisl esper esper lleg actitud madur contagig asambl esper escuch gent volunt puebl propuest propuest traig escuch call dias gent cans hech pas gobern guay llev carcel delincuent junt polic fuerz armad men año liz mit libert juec fiscal corrupt aqu quier llev pres vid junt asesin violador mism carcel def def quizas deb hab actu baj amenaz mism grup delincuencial dediqu cos veng hac agricultor igual veng busc fici quier ofici fiscal trat pon mes juec fiscal aplic sab debat habl segur igual debat pas si hac total distint cuatr años vam segu habl formul conten insegur vam logr permit total volv ecuatorian restitu confianz institu mism funcion judicial polic fuerz armad buen empez depur depur tod institu empez cuid polic fuerz armad minor empez depur rest famili va falt segur social econom van dia materi salud usted dic disminu brech hoy atencion dentr urban rural hoy siqu are urban complet cient cient medicin hospital public equip necesari com logr reduc entonc brech copi model exit dond solc junt beneficent caduc medicin acab medicin mafi inquist dentr proveedur copi funcion hac model exit ejerencial com herramient sistemat hac sol mid gast mid eficient satisfaccion client herramient cuest millon dolar plat presupuest ministeri salud public liez millon dolar año dond sujet ejempl sistem cercop compr public segun ministr ram cad vez pregunt ahi trabaj pod abastec complet toqu hospital buen hor habl cercop va ser tar va llev vicepresident blanc cancel va hac carg column vertebral pais sistem compr public transform reform jamas histori pais vicepresident vicepresident encarg manej cercop ahor vam ten va ser respons sol social com evit debacl anunci reloj corr institut equatorian segur social dic problem manten junt sistem salud sistem pension quizas divid import gener emple import gener emple jov candidat polit invoc vot jov dic van hac joven ecuador veo reves joven pued hac pais usted inyect capital jov institut segur social cualqui part mund gran ventaj joven aport mism tan joven gran diferent ley vid fisic demand muchisim men jov hoy demand unas regl jueg distint quizas materi laboral rig baj codig laboral joven unic quier trabaj clam trabaj sal univers carrer tecnic empres pid experient men vin primer huev gallin buen incentiv empres contrat personal contrat joven contrat recien gradu darl alicient aplic gobi termin dand result esper aqu abre gran cantid plaz trabaj den incent busc busc cual com cual pud ser dec empres mir sol empres emprendedor si person trabaj contig si contrat dos person voy exoner impuest rent si contrat si contrat duplic voy exoner impuest rent prox años diran buen va qued recib impuest com tap huec vam ten dobl emple va hab econom circul gent va empez ten emple van pod pag celul van pod compr carr van pod ir comedor restaur reactiv econom asi reactiv econom mund usted plante inclus cambi mall curricul bachillerat apost quizas requier dentr merc laboral busc opcion joven jamas voy dec jamas voy dec jov estudi hech much carrer falt cup carrer medicin ley administr enferm carrer falt alumn jamas voy dec jov estudi voy pod dec mir estudi vas ten emple rap dign usted habl impuest tem campañ candidat baj iva escuch ocho diez cient cual posicion respect lament pued baj ofrec baj iva tres punt cinc punt hac demasi riesg riesg corr pais pais pued perd tres mil millon dolar pued baj iva prim año dic contrari pued quebr pais ecuador pais meravill potencial result atract inversion extranjer segun cifr banc central ecuador año anterior tres trimestr men millon dolar inversion extranjer com volv atract consider usted favor consolid inversion aspect pais empez permit empres priv inversion extranjer inversion local recurs pais traig dond petrole min energ sent segur jurid pais incent empez incentiv petrole hoy dia mism dic petrole petrole mil millon dolar aqu abaj liz dec empres ok van pod particip inclusiv incentibarr contrat personal vialid qued demostr carreter man mal man concesion buen segu energ qued demostr ecuador unic pued hac depend san pedr depend lluvi import abrirl puert inversion extranjer com hech peru hech colombi tem super crisis electr com apoy inversion extranjer are especif pod desconoc ecuador pais rios rio santiag provinci moron santiag ahi pued hac hidroelectr santiag cuest mil millon dolar depend rio sol pas factur concesion entreg gobiern pas gobiern ex president laz escoller arom lad refin fantasm pacif man empres llam solarpak energ sol afirm contrat entren asi segu busc ahor dec gent verd verd proxim año import energ lluev bastant igual vam qued electr president ahor materi polit exterior com proyect cas lleg president relacion mexic ejempl trat resolv pas retom supuest supuest ten puert abiert pais braz cruz esper prox dias donald trump formul actitud segur vam pod trabaj inclus venezuel com relacion venezuel ver si pregunt venezuel cual reconozc gobiern madur com llam contrari democraci esper ver pas plan fluj migratori sol habl cuatorian pud ser deport administr donald trump sin inclus pais ven ecuador busc sent aca pas mir segur actitud donald trump haci mexic rest pais hech si compar cuand epoc deport epoc barack obam deport person epoc trump embarg trump negoci trump hombr negoci va hac negoci graci hab acompañ mañan hor graci usted entrev
